10229489-n,a person whose interests are protected by an insurance policy; a person who contracts for an insurance policy that indemnifies him against loss of property or life or health etc.,a person whose interests are protected by an insurance policy; a person who contracts for an insurance policy that indemnifies them against loss of property or life or health etc.
10244116-n,a person believed to bring bad luck to those around him,a person believed to bring bad luck to those around them
10259932-n,someone who thinks he knows everything and refuses to accept advice or information from others,someone who thinks they knows everything and refuses to accept advice or information from others
10357502-n,a Muslim engaged in what he considers to be a jihad,a Muslim engaged in what they consider to be a jihad
10402793-n,an employee who sacrifices his own individuality for the good of an organization,an employee who sacrifices their own individuality for the good of an organization
10407535-n,a person who lives away from his place of work,a person who lives away from their place of work
10407635-n,a patient who does not reside in the hospital where he is being treated,a patient who does not reside in the hospital where they are being treated
10430185-n,a young child who is small for his age,a young child who is small for their age
10431296-n,someone who travels about selling his wares (as on the streets or at carnivals),someone who travels about selling their wares (as on the streets or at carnivals)
10437588-n,a diplomat who is acceptable to the government to which he is sent,a diplomat who is acceptable to the government to which they are sent
10437714-n,a diplomat who is unacceptable to the government to which he is sent,a diplomat who is unacceptable to the government to which they are sent
10453818-n,a niggardly person who starves himself (and others),a niggardly person who starves themself (and others)
10457029-n,someone who uses another person's words or ideas as if they were his own,someone who uses another person's words or ideas as if they were their own
10472308-n,a man who is effeminate in his manner and fussy in the way he dresses,a man who is effeminate in their manner and fussy in the way they dress
10475481-n,a person who habitually pretends to be something he is not,a person who habitually pretends to be something they are not
10494031-n,the major party to a financial transaction at a stock exchange; buys and sells for his own account,the major party to a financial transaction at a stock exchange; buys and sells for their own account
10515341-n,one who intrudes or pushes himself forward,one who intrudes or pushes themself forward
10525052-n,executive who is very successful in bringing in business to his company or firm,executive who is very successful in bringing in business to their company or firm
10542669-n,a scientist who devotes himself to doing research,a scientist who devotes themself to doing research
10569482-n,someone who deceives you about his true nature or intent in order to take advantage of you,someone who deceives you about their true nature or intent in order to take advantage of you
10627901-n,a person who shirks his work or duty (especially one who tries to evade military service in wartime),a person who shirks their work or duty (especially one who tries to evade military service in wartime)
10654388-n,an orator who can hold his listeners spellbound,an orator who can hold their listeners spellbound
10655186-n,an inscrutable person who keeps his thoughts and intentions secret,an inscrutable person who keeps their thoughts and intentions secret
10658445-n,a person known for the way she (or he) behaves when teased or defeated or subjected to trying circumstances,a person known for the way they behave when teased or defeated or subjected to trying circumstances
10682391-n,a child who spends most of his time in the streets especially in slum areas,a child who spends most of their time in the streets especially in slum areas
10693108-n,a person who kills himself intentionally,a person who kills themself intentionally
10693215-n,a terrorist who blows himself up in order to kill or injure other people,a terrorist who blows themself up in order to kill or injure other people
10701338-n,someone (usually maleficent) who tries to persuade or force another person to do his bidding,someone (usually maleficent) who tries to persuade or force another person to do their bidding
10701616-n,an itinerant Australian laborer who carries his personal belongings in a bundle as he travels around in search of work,an itinerant Australian laborer who carries their personal belongings in a bundle as they travels around in search of work
10742614-n,someone who betrays his country by committing treason,someone who betrays their country by committing treason
10765000-n,a manservant who acts as a personal attendant to his employer,a manservant who acts as a personal attendant to their employer
10783796-n,an operative who initiates his own defection (usually to a hostile country) for political asylum,an operative who initiates their own defection (usually to a hostile country) for political asylum
10802308-n,the pilot who positions his aircraft outside and behind (on the wing of) the leader of a flying formation,the pilot who positions their aircraft outside and behind (on the wing of) the leader of a flying formation
10803557-n,one who uses secret influence (i.e. pulls wires or strings) for his own ends,one who uses secret influence (i.e. pulls wires or strings) for their own ends
10823190-n,in former times was free and cultivated his own land,in former times was free and cultivated their own land
08604380-n,the seat within a bishop's diocese where his cathedral is located,the seat within a bishop's diocese where the bishop's cathedral is located
13267561-n,extensive landed property (especially in the country) retained by the owner for his own use,extensive landed property (especially in the country) retained by the owner for their own use
13304056-n,compensation for death or injury suffered by a worker in the course of his employment,compensation for death or injury suffered by a worker in the course of their employment
13305585-n,payment made to a person in a position of trust to corrupt his judgment,payment made to a person in a position of trust to corrupt their judgment
13305996-n,a bribe given to a disc jockey to induce him to promote a particular record,a bribe given to a disc jockey to induce them to promote a particular record
13316383-n,an annuity scheme wherein participants share certain benefits and on the death of any participant his benefits are redistributed among the remaining participants; can run for a fixed period of time or until the death of all but one participant,an annuity scheme wherein participants share certain benefits and on the death of any participant their benefits are redistributed among the remaining participants; can run for a fixed period of time or until the death of all but one participant
13332007-n,a deduction allowed to a taxpayer because of his status (having certain dependents or being blind or being over 65 etc.),a deduction allowed to a taxpayer because of their status (having certain dependents or being blind or being over 65 etc.)
13344482-n,something for something; that which a party receives (or is promised) in return for something he does or gives or promises,something for something; that which a party receives (or is promised) in return for something they do or give or promise
13360204-n,a bond made by a reversioner to secure a loan; payable out of his reversion,a bond made by a reversioner to secure a loan; payable out of their reversion
13362365-n,"(law) an interest in an estate that reverts to the grantor (or his heirs) at the end of some period (e.g., the death of the grantee)","(law) an interest in an estate that reverts to the grantor (or their heirs) at the end of some period (e.g., the death of the grantee)"
13364299-n,(stock market) a series of transactions in which the speculator increases his holdings by using the rising market value of those holdings as margin for further purchases,(stock market) a series of transactions in which the speculator increases their holdings by using the rising market value of those holdings as margin for further purchases
13366575-n,a system of automobile insurance where a party who is injured in an automobile accident recovers damages up to a specific amount against his own insurance company regardless of who was responsible for the accident,a system of automobile insurance where a party who is injured in an automobile accident recovers damages up to a specific amount against their own insurance company regardless of who was responsible for the accident
13368765-n,a form of life insurance whereby on the death or default of a participant his share is distributed to the remaining members,a form of life insurance whereby on the death or default of a participant their share is distributed to the remaining members
13400437-n,credit opened by an importer at a bank in his own country upon which an exporter may draw,credit opened by an importer at a bank in their own country upon which an exporter may draw
13423863-n,lien of which a tax collector may avail himself in default of taxes (analogous to a judgment lien),lien of which a tax collector may avail themself in default of taxes (analogous to a judgment lien)
13428381-n,a creditor's accounts of money owed to him; normally arise from the sale of products or services,a creditor's accounts of money owed to them; normally arise from the sale of products or services
13428734-n,a debtor's accounts of money he owes; normally arise from the purchase of products or services,a debtor's accounts of money they owes; normally arise from the purchase of products or services
92414965-n,"the minimum amount of classes a teacher has to conduct, as stated in his contract.","the minimum amount of classes a teacher has to conduct, as stated in their contract."
02802601-n,a trading card with a picture of a baseball player and information about his playing record,a trading card with a picture of a baseball player and information about their playing record
02908613-n,place where a broker conducts his business,place where a broker conducts their business
02979048-n,"(printing) the receptacle in which a compositor has his type, which is divided into compartments for the different letters, spaces, or numbers","(printing) the receptacle in which a compositor has their type, which is divided into compartments for the different letters, spaces, or numbers"
03150385-n,the ball that the billiard player or pool player strikes with his cue,the ball that the billiard player or pool player strikes with their cue
03206680-n,a pail in which a workman carries his lunch or dinner,a pail in which a workman carries their lunch or dinner
03360884-n,the ship that carries the commander of a fleet and flies his flag,the ship that carries the commander of a fleet and flies their flag
04029816-n,a small board full of holes; each hole contains a slip of paper with symbols printed on it; a gambler pays a small sum for the privilege of pushing out a slip in the hope of obtaining one that entitles him to a prize,a small board full of holes; each hole contains a slip of paper with symbols printed on it; a gambler pays a small sum for the privilege of pushing out a slip in the hope of obtaining one that entitles them to a prize
04385576-n,a short sleeveless outer tunic emblazoned with a coat of arms; worn by a knight over his armor or by a herald,a short sleeveless outer tunic emblazoned with a coat of arms; worn by a knight over the knight's armor or by a herald
oewn-10612003-n,a commercial agent who shops at the competitor's store in order to compare their prices and merchandise with those of the store that employs her,a commercial agent who shops at the competitor's store in order to compare their prices and merchandise with those of the store that employs them
oewn-02555865-v,"watch over like a shepherd, as a teacher of her pupils","watch over like a shepherd, as a teacher of their pupils"
